{
  "id": "mission.w1.heavies",
  "title": "Sugarworks: Heavies",
  "chapter": "chapter.world1",
  "kind": "challenge",
  "level": "sugarworks",
  "summary": "Take down the big ones.",
  "requires": {
    "missions": [
      "mission.vastor"
    ]
  },
  "objectives": [
    {
      "id": "heavies",
      "text": "Defeat 2 brutes",
      "kind": "defeat",
      "count": 2,
      "enemyType": "enemy.brute"
    }
  ],
  "spawns": [
    {
      "when": {
        "start": true
      },
      "enemies": [
        {
          "type": "enemy.brute",
          "pos": [
            -11.0,
            0.01,
            33.0
          ],
          "count": 2,
          "spread": 3.0
        }
      ]
    }
  ],
  "dialogue": [],
  "reward": {
    "scrap": 50,
    "xp": 80
  },
  "timeLimit": 90
}
