{
  "id": "mission.w2.sweep",
  "title": "Cloudspire: Sweep",
  "chapter": "chapter.world2",
  "kind": "challenge",
  "level": "cloudspire",
  "summary": "Clear a pack before the clock runs out.",
  "requires": {
    "missions": [
      "mission.vastor"
    ]
  },
  "objectives": [
    {
      "id": "sweep",
      "text": "Defeat 8 enemies",
      "kind": "defeat",
      "count": 8
    }
  ],
  "spawns": [
    {
      "when": {
        "start": true
      },
      "enemies": [
        {
          "type": "enemy.shard",
          "pos": [
            0,
            0.01,
            -44
          ],
          "count": 8,
          "spread": 1.4
        }
      ]
    }
  ],
  "dialogue": [],
  "reward": {
    "scrap": 40,
    "xp": 60
  },
  "timeLimit": 70
}
