{
  "id": "mission.w2.untouchable",
  "title": "Cloudspire: Untouchable",
  "chapter": "chapter.world2",
  "kind": "challenge",
  "level": "cloudspire",
  "summary": "Stay alive for 30 seconds without being hit.",
  "requires": {
    "missions": [
      "mission.vastor"
    ]
  },
  "objectives": [
    {
      "id": "hold",
      "text": "Survive 30 seconds without a scratch",
      "kind": "survive",
      "seconds": 30
    }
  ],
  "spawns": [
    {
      "when": {
        "start": true
      },
      "enemies": [
        {
          "type": "enemy.shard",
          "pos": [
            -44,
            0.01,
            52
          ],
          "count": 3,
          "spread": 1.4
        }
      ]
    }
  ],
  "dialogue": [],
  "reward": {
    "scrap": 45,
    "xp": 70
  },
  "noDamage": true
}
